{
  "schemaVersion": 1,
  "inventorySchemaVersion": 1,
  "sourceInventory": "docs/api-route-inventory.json",
  "featureLedger": "docs/feature-ledger.json",
  "completionPlan": "docs/plans/2026-07-20-terroir-completion-spec.md",
  "summary": {
    "activeRequirementCount": 328,
    "concreteRequirementCount": 36,
    "exactDiscoveredCount": 18,
    "plannedPromiseCount": 18,
    "extensionDiscoveredCount": 99,
    "crossCuttingRequirementCount": 6,
    "ter020LeafCount": 8
  },
  "planLeaves": [
    {
      "id": "TER-020Aa",
      "heading": "Generate the source-only API route inventory"
    },
    {
      "id": "TER-020Ab",
      "heading": "Reconcile all active API requirements without amendments"
    },
    {
      "id": "TER-020Ac",
      "heading": "Enforce route-inventory drift checks in CI"
    },
    {
      "id": "TER-020B",
      "heading": "Standardize Zod validation and error envelopes"
    },
    {
      "id": "TER-020C",
      "heading": "Centralize authentication, authorization, and tenant isolation"
    },
    {
      "id": "TER-020D",
      "heading": "Apply per-user rate limits and request idempotency"
    },
    {
      "id": "TER-020E",
      "heading": "Implement all missing promised compatibility handlers at their exact paths"
    },
    {
      "id": "TER-020F",
      "heading": "Generate final contract tests and reject unregistered routes"
    }
  ],
  "concreteRequirements": [
    {
      "requirementId": "TER-CF-180",
      "method": "GET",
      "path": "/api/health",
      "operationId": "api:GET:/api/health",
      "realization": "discovered_exact_path",
      "implementationLeaf": null
    },
    {
      "requirementId": "TER-CF-181",
      "method": "GET",
      "path": "/api/cellar",
      "operationId": "api:GET:/api/cellar",
      "realization": "planned_exact_path",
      "implementationLeaf": "TER-020E"
    },
    {
      "requirementId": "TER-CF-182",
      "method": "POST",
      "path": "/api/cellar",
      "operationId": "api:POST:/api/cellar",
      "realization": "discovered_exact_path",
      "implementationLeaf": null
    },
    {
      "requirementId": "TER-CF-183",
      "method": "PATCH",
      "path": "/api/cellar/[id]",
      "operationId": "api:PATCH:/api/cellar/{param}",
      "realization": "discovered_exact_path",
      "implementationLeaf": null
    },
    {
      "requirementId": "TER-CF-184",
      "method": "DELETE",
      "path": "/api/cellar/[id]",
      "operationId": "api:DELETE:/api/cellar/{param}",
      "realization": "discovered_exact_path",
      "implementationLeaf": null
    },
    {
      "requirementId": "TER-CF-185",
      "method": "GET",
      "path": "/api/wines",
      "operationId": "api:GET:/api/wines",
      "realization": "planned_exact_path",
      "implementationLeaf": "TER-020E"
    },
    {
      "requirementId": "TER-CF-186",
      "method": "GET",
      "path": "/api/wines/[id]",
      "operationId": "api:GET:/api/wines/{param}",
      "realization": "planned_exact_path",
      "implementationLeaf": "TER-020E"
    },
    {
      "requirementId": "TER-CF-187",
      "method": "POST",
      "path": "/api/scan",
      "operationId": "api:POST:/api/scan",
      "realization": "discovered_exact_path",
      "implementationLeaf": null
    },
    {
      "requirementId": "TER-CF-188",
      "method": "GET",
      "path": "/api/scans",
      "operationId": "api:GET:/api/scans",
      "realization": "planned_exact_path",
      "implementationLeaf": "TER-020E"
    },
    {
      "requirementId": "TER-CF-189",
      "method": "GET",
      "path": "/api/scans/[id]",
      "operationId": "api:GET:/api/scans/{param}",
      "realization": "planned_exact_path",
      "implementationLeaf": "TER-020E"
    },
    {
      "requirementId": "TER-CF-190",
      "method": "POST",
      "path": "/api/scan-bottle",
      "operationId": "api:POST:/api/scan-bottle",
      "realization": "discovered_exact_path",
      "implementationLeaf": null
    },
    {
      "requirementId": "TER-CF-191",
      "method": "GET",
      "path": "/api/inventory",
      "operationId": "api:GET:/api/inventory",
      "realization": "planned_exact_path",
      "implementationLeaf": "TER-020E"
    },
    {
      "requirementId": "TER-CF-192",
      "method": "POST",
      "path": "/api/pour",
      "operationId": "api:POST:/api/pour",
      "realization": "discovered_exact_path",
      "implementationLeaf": null
    },
    {
      "requirementId": "TER-CF-193",
      "method": "POST",
      "path": "/api/reconcile",
      "operationId": "api:POST:/api/reconcile",
      "realization": "discovered_exact_path",
      "implementationLeaf": null
    },
    {
      "requirementId": "TER-CF-194",
      "method": "GET",
      "path": "/api/wine-lists",
      "operationId": "api:GET:/api/wine-lists",
      "realization": "planned_exact_path",
      "implementationLeaf": "TER-020E"
    },
    {
      "requirementId": "TER-CF-195",
      "method": "POST",
      "path": "/api/wine-lists",
      "operationId": "api:POST:/api/wine-lists",
      "realization": "discovered_exact_path",
      "implementationLeaf": null
    },
    {
      "requirementId": "TER-CF-196",
      "method": "PATCH",
      "path": "/api/wine-lists/[id]",
      "operationId": "api:PATCH:/api/wine-lists/{param}",
      "realization": "discovered_exact_path",
      "implementationLeaf": null
    },
    {
      "requirementId": "TER-CF-197",
      "method": "DELETE",
      "path": "/api/wine-lists/[id]",
      "operationId": "api:DELETE:/api/wine-lists/{param}",
      "realization": "discovered_exact_path",
      "implementationLeaf": null
    },
    {
      "requirementId": "TER-CF-198",
      "method": "GET",
      "path": "/api/wine-list-sections",
      "operationId": "api:GET:/api/wine-list-sections",
      "realization": "planned_exact_path",
      "implementationLeaf": "TER-020E"
    },
    {
      "requirementId": "TER-CF-199",
      "method": "POST",
      "path": "/api/wine-list-sections",
      "operationId": "api:POST:/api/wine-list-sections",
      "realization": "discovered_exact_path",
      "implementationLeaf": null
    },
    {
      "requirementId": "TER-CF-200",
      "method": "PATCH",
      "path": "/api/wine-list-sections/[id]",
      "operationId": "api:PATCH:/api/wine-list-sections/{param}",
      "realization": "discovered_exact_path",
      "implementationLeaf": null
    },
    {
      "requirementId": "TER-CF-201",
      "method": "GET",
      "path": "/api/wine-list-items",
      "operationId": "api:GET:/api/wine-list-items",
      "realization": "planned_exact_path",
      "implementationLeaf": "TER-020E"
    },
    {
      "requirementId": "TER-CF-202",
      "method": "POST",
      "path": "/api/wine-list-items",
      "operationId": "api:POST:/api/wine-list-items",
      "realization": "discovered_exact_path",
      "implementationLeaf": null
    },
    {
      "requirementId": "TER-CF-203",
      "method": "PATCH",
      "path": "/api/wine-list-items/[id]",
      "operationId": "api:PATCH:/api/wine-list-items/{param}",
      "realization": "discovered_exact_path",
      "implementationLeaf": null
    },
    {
      "requirementId": "TER-CF-204",
      "method": "GET",
      "path": "/api/insights",
      "operationId": "api:GET:/api/insights",
      "realization": "discovered_exact_path",
      "implementationLeaf": null
    },
    {
      "requirementId": "TER-CF-205",
      "method": "GET",
      "path": "/api/restaurant",
      "operationId": "api:GET:/api/restaurant",
      "realization": "planned_exact_path",
      "implementationLeaf": "TER-020E"
    },
    {
      "requirementId": "TER-CF-206",
      "method": "PATCH",
      "path": "/api/restaurant",
      "operationId": "api:PATCH:/api/restaurant",
      "realization": "planned_exact_path",
      "implementationLeaf": "TER-020E"
    },
    {
      "requirementId": "TER-CF-207",
      "method": "GET",
      "path": "/api/team",
      "operationId": "api:GET:/api/team",
      "realization": "planned_exact_path",
      "implementationLeaf": "TER-020E"
    },
    {
      "requirementId": "TER-CF-208",
      "method": "POST",
      "path": "/api/team",
      "operationId": "api:POST:/api/team",
      "realization": "planned_exact_path",
      "implementationLeaf": "TER-020E"
    },
    {
      "requirementId": "TER-CF-209",
      "method": "DELETE",
      "path": "/api/team/[membership_id]",
      "operationId": "api:DELETE:/api/team/{param}",
      "realization": "planned_exact_path",
      "implementationLeaf": "TER-020E"
    },
    {
      "requirementId": "TER-CF-210",
      "method": "POST",
      "path": "/api/pdf",
      "operationId": "api:POST:/api/pdf",
      "realization": "discovered_exact_path",
      "implementationLeaf": null
    },
    {
      "requirementId": "TER-CF-211",
      "method": "GET",
      "path": "/api/export",
      "operationId": "api:GET:/api/export",
      "realization": "planned_exact_path",
      "implementationLeaf": "TER-020E"
    },
    {
      "requirementId": "TER-CF-288",
      "method": "POST",
      "path": "/api/integrations/pos/toast/imports",
      "operationId": "api:POST:/api/integrations/pos/toast/imports",
      "realization": "planned_exact_path",
      "implementationLeaf": "TER-020E"
    },
    {
      "requirementId": "TER-CF-289",
      "method": "GET",
      "path": "/api/integrations/pos/toast/reconciliation",
      "operationId": "api:GET:/api/integrations/pos/toast/reconciliation",
      "realization": "planned_exact_path",
      "implementationLeaf": "TER-020E"
    },
    {
      "requirementId": "TER-CF-290",
      "method": "POST",
      "path": "/api/integrations/pos/toast/observations/[id]/interpretations",
      "operationId": "api:POST:/api/integrations/pos/toast/observations/{param}/interpretations",
      "realization": "planned_exact_path",
      "implementationLeaf": "TER-020E"
    },
    {
      "requirementId": "TER-CF-297",
      "method": "GET",